<LocalisationResponse xmlns="http://ups/fr/carpooling/schemas"
        xmlns:xs="http://www.w3.org/2001/XMLSchema-instance"
        xs:schemaLocation="http://ups/fr/carpooling/schemas Localisation.xsd "
        UserID="1"
        RadiusKM="5">
    <User>
        <LastName>Silvestre</LastName>
        <FirstName>Franck</FirstName>
        <UPSMail>franck.silvestre@univ-tlse3.fr</UPSMail>
        <Address>118 route de Narbonne</Address>
        <ZipCode>31520</ZipCode>
        <Town>Toulouse</Town>
    </User>
    <User>
        <LastName>Massie</LastName>
        <FirstName>Henry</FirstName>
        <UPSMail>henry.massie@univ-tlse3.fr</UPSMail>
        <Address>rue sylvain dauriac</Address>
        <ZipCode>31506</ZipCode>
        <Town>Toulouse</Town>
    </User>
    <User>
        <LastName>Cherbonneau</LastName>
        <FirstName>Bernard</FirstName>
        <UPSMail>bernard.cherbonneau@univ-tlse3.fr</UPSMail>
        <Address>rue d'alger</Address>
        <ZipCode>31500</ZipCode>
        <Town>Toulouse</Town>
    </User>
</LocalisationResponse>
