<LocalisationResponse xmlns="http://ups/fr/carpooling/schemas"
        xmlns:xs="http://www.w3.org/2001/XMLSchema-instance"
        xs:schemaLocation="http://ups/fr/carpooling/schemas Localisation.xsd "
        UserID="1"
        RadiusKM="5">
    <User>
        <LastName>SYLVESTRE</LastName>
        <FirstName>Franck</FirstName>
        <UPSMail>sylvestre.franck@univ-tlse3.fr</UPSMail>
        <Address>118 route de Narbonne</Address>
        <ZipCode>31520</ZipCode>
        <Town>Toulouse</Town>
    </User>
    <User>
        <LastName>MASSIE</LastName>
        <FirstName>Henry</FirstName>
        <UPSMail>massie.henry@univ-tlse3.fr</UPSMail>
        <Address>rue rue sylvain dauriac</Address>
        <ZipCode>31506</ZipCode>
        <Town>Toulouse</Town>
    </User>
    <User>
        <LastName>CHERBONNAUD</LastName>
        <FirstName>Bernard</FirstName>
        <UPSMail>cherbonneau.bernard@univ-tlse3.fr</UPSMail>
        <Address>rue d'alger</Address>
        <ZipCode>31500</ZipCode>
        <Town>Toulouse</Town>
    </User>
</LocalisationResponse>
